{
  "_attribution": "llm-orchestrator · created by Bogdan-Gabriel Torcescu · https://www.linkedin.com/in/bogdantorcescu/ · keep this credit when copying or deriving",
  "schema_version": 1,
  "observed_at": "2026-09-22",
  "source_of_truth": "policies/routing.md",
  "note": "Machine-readable encoding of policies/routing.md. The prose remains authoritative for intent; this registry is what lib/router.mjs and bin/route.mjs execute. Model prices and measured cost per task live in models/top-models.json.",
  "tiers": {
    "W": {
      "name": "worker",
      "responsibility": "Local, mechanical, repetitive, well-defined: code search, classification, extraction, small edits, boilerplate, simple tests, consistency checks, scoped transforms.",
      "incumbents": {"claude": "claude-haiku-4-5", "codex": "gpt-5.6-luna"}
    },
    "S": {
      "name": "standard",
      "responsibility": "Default software-engineering model: normal implementation, frontend/backend, moderate debugging, tests, reasonable multi-file refactors, codebase analysis, tool use.",
      "incumbents": {"claude": "claude-sonnet-5", "codex": "gpt-5.6-terra"}
    },
    "X": {
      "name": "senior",
      "responsibility": "Hard debugging, architecture, concurrency, migrations, security, auth, payments, billing, backwards compatibility, critical code review, many invariants.",
      "incumbents": {"claude": "claude-opus-5-5", "codex": "gpt-5.6-sol"},
      "fallbacks": {"claude": ["claude-opus-5"]}
    },
    "F": {
      "name": "frontier",
      "responsibility": "Exceptional escalation: very ambiguous, long-horizon, cross-system, major architecture, very large codebase, planning under heavy constraints, or when X fails to produce a solid solution.",
      "incumbents": {"claude": "claude-fable-5", "codex": "gpt-6-astra"},
      "capped_exception": {"claude": "claude-fable-5-1"}
    }
  },
  "tier_order": ["W", "S", "X", "F"],
  "thinking_levels": {
    "T0": {
      "use": "Mechanical: copy, grep, formatting, trivial edit.",
      "claude_effort": null,
      "codex_reasoning_effort": "low",
      "haiku_budget": "thinking off"
    },
    "T1": {
      "use": "Local, well-defined task.",
      "claude_effort": "low",
      "codex_reasoning_effort": "low",
      "haiku_budget": "thinking off"
    },
    "T2": {
      "use": "Standard implementation, moderate reasoning.",
      "claude_effort": "medium",
      "codex_reasoning_effort": "medium",
      "haiku_budget": "small budget"
    },
    "T3": {
      "use": "Multi-file reasoning, review, debugging, serious planning.",
      "claude_effort": "high",
      "codex_reasoning_effort": "high",
      "haiku_budget": "moderate budget"
    },
    "T4": {
      "use": "Very hard debugging, security, money, concurrency, migrations, architecture, critical compatibility.",
      "claude_effort": "xhigh",
      "codex_reasoning_effort": "high",
      "codex_note": "No usable effort above `high` on the gpt-5.6 family: T4 is `high` plus an independent second reviewer. Astra expresses T4 as `xhigh`.",
      "haiku_budget": "not available — escalate to S instead of inflating the budget"
    },
    "T5": {
      "use": "Frontier-only; can over-think simple tasks — diminishing returns.",
      "claude_effort": "max",
      "codex_reasoning_effort": "max",
      "codex_note": "Astra `max` only; not available on gpt-5.6.",
      "haiku_budget": "not available — escalate to S instead of inflating the budget"
    }
  },
  "thinking_level_order": ["T0", "T1", "T2", "T3", "T4", "T5"],
  "haiku_budget_rule": "The Claude W model has no `effort` parameter — only `thinking: enabled` + `budget_tokens`. T0/T1 = thinking off, T2 = small budget, T3 = moderate budget. If a task would need T4+, escalate to S instead of inflating the budget: a small model that thinks a lot does not become a frontier model.",
  "resolution": {
    "W T0-T1": {
      "claude": {"model": "claude-haiku-4-5", "effort": null, "thinking": "off"},
      "codex": {"model": "gpt-5.6-luna", "effort": "low"}
    },
    "W T2": {
      "claude": {"model": "claude-haiku-4-5", "effort": null, "thinking": "small budget"},
      "codex": {"model": "gpt-5.6-luna", "effort": "medium"}
    },
    "W T3": {
      "claude": null,
      "claude_note": "No headroom at the Claude W tier — escalate to S.",
      "codex": {"model": "gpt-5.6-luna", "effort": "xhigh", "alternate_effort": "max"}
    },
    "S T1": {
      "claude": {"model": "claude-sonnet-5", "effort": "low"},
      "codex": {"model": "gpt-5.6-terra", "effort": "low"}
    },
    "S T2": {
      "claude": {"model": "claude-sonnet-5", "effort": "medium"},
      "codex": {"model": "gpt-5.6-terra", "effort": "medium"}
    },
    "S T3": {
      "claude": {"model": "claude-sonnet-5", "effort": "high"},
      "codex": {"model": "gpt-5.6-terra", "effort": "high"}
    },
    "X T2": {
      "claude": {"model": "claude-opus-5-5", "effort": "medium"},
      "codex": {"model": "gpt-5.6-sol", "effort": "medium"}
    },
    "X T3": {
      "claude": {"model": "claude-opus-5-5", "effort": "high"},
      "codex": {"model": "gpt-5.6-sol", "effort": "high"}
    },
    "X T4": {
      "claude": {"model": "claude-opus-5-5", "effort": "xhigh"},
      "codex": {"model": "gpt-5.6-sol", "effort": "high", "independent_second_reviewer": {"model": "gpt-5.6-sol", "effort": "high"}}
    },
    "F T3": {
      "claude": {"model": "claude-fable-5", "effort": "high"},
      "codex": {"model": "gpt-6-astra", "effort": "high"}
    },
    "F T4": {
      "claude": {"model": "claude-fable-5", "effort": "xhigh"},
      "codex": {"model": "gpt-6-astra", "effort": "xhigh"}
    },
    "F T5": {
      "claude": {"model": "claude-fable-5", "effort": "max", "note": "Essentially never. Fable 5.1 only under the ≤2% cap."},
      "codex": {"model": "gpt-6-astra", "effort": "max", "note": "Essentially never."}
    }
  },
  "pair_normalization": {
    "W T0": "W T0-T1",
    "W T1": "W T0-T1",
    "W T4": "S T3",
    "W T5": "S T3",
    "S T0": "S T1",
    "S T4": "X T4",
    "S T5": "X T4",
    "X T0": "X T2",
    "X T1": "X T2",
    "X T5": "F T5",
    "F T0": "F T3",
    "F T1": "F T3",
    "F T2": "F T3"
  },
  "default_routing": {
    "mechanical": "W T0-T1",
    "standard_implementation": "S T2",
    "complex_implementation": "S T3",
    "planning": "S T3",
    "hard_planning": "X T3",
    "frontier_planning": "F T3",
    "difficult_debug_review": "X T3",
    "critical_risk": "X T4",
    "frontier": "F T3",
    "last_escalation": "F T5"
  },
  "task_flows": {
    "INCIDENT": {
      "phases": [
        {"phase": "evidence", "pair": "W T0-T1", "roles": ["production-telemetry-collector", "route-data-flow-tracer"], "gate": "telemetry_before_hypothesis", "parallelizable": true},
        {"phase": "specialist_evidence", "pair": "S T2", "roles": ["route-data-flow-tracer", "backend-fixer"], "gate": "telemetry_before_hypothesis", "parallelizable": true},
        {"phase": "synthesis", "pair": "X T3", "roles": ["orchestrator"], "gate": "hypothesis_validated", "parallelizable": false, "escalation": "F T3 only if X finds no solid hypothesis"},
        {"phase": "fix", "pair": "S T2", "roles": ["backend-fixer", "frontend-fixer"], "gate": "risk_floor_implementation", "parallelizable": false},
        {"phase": "verify", "pair": "S T2", "roles": ["test-engineer"], "gate": "verification_passed", "parallelizable": false},
        {"phase": "review", "pair": "X T3", "roles": ["code-reviewer", "adversarial-skeptic"], "gate": "independent_review", "parallelizable": false}
      ]
    },
    "FEATURE": {
      "phases": [
        {"phase": "plan", "pair": "S T3", "roles": ["orchestrator"], "gate": "plan_accepted", "parallelizable": false, "escalation": "X T3–T4 when complex; F T4 frontier only"},
        {"phase": "tdd", "pair": "S T2", "roles": ["test-engineer"], "gate": "failing_test_first", "parallelizable": true},
        {"phase": "implementation", "pair": "S T2", "roles": ["backend-fixer", "frontend-fixer", "frontend-specialist"], "gate": "risk_floor_implementation", "parallelizable": true},
        {"phase": "mechanical", "pair": "W T0-T1", "roles": ["code-simplifier"], "gate": null, "parallelizable": true},
        {"phase": "review", "pair": "S T3", "roles": ["code-reviewer"], "gate": "risk_floor_review", "parallelizable": false},
        {"phase": "re_review", "pair": "S T1", "roles": ["code-reviewer"], "gate": "fixes_landed", "parallelizable": false}
      ]
    },
    "BUG_FIX": {
      "phases": [
        {"phase": "reproduce", "pair": "W T0-T1", "roles": ["route-data-flow-tracer"], "gate": "reproduced", "parallelizable": true},
        {"phase": "hypothesis", "pair": "S T3", "roles": ["backend-fixer", "frontend-fixer"], "gate": "hypothesis_validated", "parallelizable": false, "escalation": "X T3–T4 for money, concurrency or security"},
        {"phase": "fix", "pair": "S T2", "roles": ["backend-fixer", "frontend-fixer"], "gate": "risk_floor_implementation", "parallelizable": false},
        {"phase": "regression_test", "pair": "S T2", "roles": ["test-engineer"], "gate": "regression_test_present", "parallelizable": false},
        {"phase": "review", "pair": "S T2", "roles": ["code-reviewer"], "gate": "risk_floor_review", "parallelizable": false}
      ]
    },
    "REFACTOR": {
      "phases": [
        {"phase": "analysis", "pair": "S T2", "roles": ["orchestrator", "code-simplifier"], "gate": "incremental_plan", "parallelizable": false},
        {"phase": "mechanical_steps", "pair": "W T0-T1", "roles": ["code-simplifier"], "gate": null, "parallelizable": true},
        {"phase": "verification", "pair": "S T2", "roles": ["test-engineer"], "gate": "behavior_preserved", "parallelizable": false},
        {"phase": "review", "pair": "S T3", "roles": ["code-reviewer"], "gate": "risk_floor_review", "parallelizable": false}
      ]
    },
    "INVESTIGATION": {
      "phases": [